app_id,game_name,review_text,sentiment_score,sentiment_label,sentiment_confidence,review_helpful,review_timestamp,processed_timestamp
730,Counter-Strike 2,"It could be one of the greatest game ever, but the cheater problem is getting out of hand...",-0.734567403793335,negative,0.734567403793335,0,2025-08-24 03:35:26+00,2025-09-18 15:32:09.614059+00
570,Dota 2,"It's hard to play and grow comfortable with, but you can easily spend thousands of hours in this and feel like you still have more to get out of it.",0,neutral,0.42966368794441223,0,2025-09-15 20:37:31+00,2025-09-18 15:32:09.726316+00
730,Counter-Strike 2,"CS2 is unfortunately becoming known as “the cheaters’ game.”
Almost every match is filled with hackers and it’s ruining the entire experience.
VAC is not strong enough and bans are way too slow.
Please take stronger and faster action against cheaters, otherwise many players will leave.
We love CS2, but fair players deserve a clean game, not a cheaters’ playground.",-0.9153426289558411,negative,0.9153426289558411,0,2025-08-24 08:25:42+00,2025-09-18 15:32:09.892241+00
730,Counter-Strike 2,"CS2 is an amazing game with great mechanics and graphics, but it’s really sad to see it filled with cheaters. The developers should take stronger action against this issue, because the game deserves better.",-0.8743076920509338,negative,0.8743076920509338,0,2025-09-17 11:11:37+00,2025-09-18 15:32:10.021606+00
730,Counter-Strike 2,"u start a game of compe ur teammates
a russian
another russian
a guy from poland
a guy from turkish
and you
very good game
",0.7298775315284729,positive,0.7298775315284729,0,2025-08-20 09:30:55+00,2025-09-18 15:32:10.267844+00
730,Counter-Strike 2,The gameplay is still state of the art after 26 years - nonetheless I don't understand why Valve doesn't implement the overwatch feature from CS:GO to get at least the most blatant and shameless cheater for a better gaming experience,-0.7194240689277649,negative,0.7194240689277649,0,2025-09-02 06:19:41+00,2025-09-18 15:32:10.426569+00
570,Dota 2,bad game,-0.6630274057388306,negative,0.6630274057388306,0,2025-09-02 22:31:01+00,2025-09-18 15:32:10.504854+00
730,Counter-Strike 2,Don't bother with CS2 right now. This game is plagued with hackers. VAC is highly inconsistent and sucks balls quite frankly. There are way too many issues with the maps and Valve could care less about actually fixing it. Tons more issues with the gameplay.,-0.9578558206558228,negative,0.9578558206558228,0,2025-09-03 05:08:31+00,2025-09-18 15:32:10.702499+00
730,Counter-Strike 2,"At this point, I’m convinced the anti-cheat is just a guy at Valve named Greg who occasionally glances at match replays during lunch and shrugs.",0,neutral,0.4860844910144806,0,2025-08-22 14:41:58+00,2025-09-18 15:32:10.808179+00
570,Dota 2,Dotes McGotes,0,neutral,0.7562088370323181,0,2025-09-14 19:12:54+00,2025-09-18 15:32:10.898075+00
730,Counter-Strike 2,"If you like to be very angry, like all the time... Go play this game!
And if you like to be very happy all the time... Go play this game!
But... if you dont want both.. GO PLAY THIS GAME!",0.6166811585426331,positive,0.6166811585426331,0,2025-08-21 20:05:13+00,2025-09-18 15:32:41.091613+00
730,Counter-Strike 2,"CS2 is the place where I spend my evenings with a cold beer in hand, meeting all sorts of people. Sometimes you find great teammates who actually want to win together, and other times… well, you end up in what feels like a chaotic circus where your own team is your biggest enemy.

One round you’re making perfect calls, the next round someone is yelling “uninstall, you shoot like a potato!” or giving you a full 30-minute TED Talk about your mother. And honestly? That’s the beauty of Silver life. It’s messy, it’s loud, it’s unpredictable—but it’s also absolutely hilarious.

So grab a drink, queue up, and embrace the madness. Silver never dies—it just respawns with a worse buy.

👍 10/10, would get flamed by teammates again.",0.7175683379173279,positive,0.7175683379173279,0,2025-09-06 18:45:14+00,2025-09-18 15:32:41.320678+00
730,Counter-Strike 2,"I started playing Counter-Strike in version 1.3 and moved to 1.5 before switching to 1.6 for competitive matches. I avoided playing Source and CS:GO because their slow gameplay speed deviated from the traditional fast Counter-Strike gameplay I loved.

The new matchmaking system in Counter-Strike 2 interests me, but the gameplay experience differs substantially from what I expected. The game visuals and textures appear too refined which creates a plasticine effect that disrupts the game's visual appearance. It is an acquired visual, and not sure I enjoy the one presented here even after adapting to it.

The weapons sound design is quite poor. It's quite muffled, while the visual distinction between players and their surroundings creates difficulties when trying to detect enemies. The footstep audio is also quite reduced to the original setting, making it harder to detect opponents who are nearby. The grenades are tiny, barely visible.

The essential gameplay elements which made the classic Counter-Strike versions 1.5 and 1.6 unique have undergone significant changes, and it is very apparent. My 25 years of experience with the series made it difficult to adjust to CS2 because I needed to relearn basic gameplay mechanics which surprised me as a seasoned player. Yeah, my headshot ratio is still high, however the movement, and generally the speed, element of surprise is completely gone. It takes forever to rush a single bomb site. The models feel heavy, sluggish, even with a knife. The jumping mechanism is slower than usual.

One thing that made Counter-Strike 1.5 and 1.6 great, was the movement. You could easily navigate, with a bit of practice. In CS2 it feels like an uphill battle for no reason.

The CS2 does retain some of the Counter-Strike flair, yet it presents a completely different gameplay experience than the original versions. The main problem in ranked matches of CS2 stems from the high number of cheaters who play against legitimate players. The high number of fake and purchased accounts creates a noticeable problem which ruins the gameplay experience. These are not small number of players, this is notably every 2nd account that is in any ranked matchmaking. They either use Wallhack, or Aimbot, or a combination of the two. It's very typical. 

Although CS 1.5 and 1.6 have their own Cheater issues, these are mostly easily recognized, and people who cheat tend to get punished quickly by server ban.

I have not fully investigated Faceit but I believe cheating might still exist within this platform, unsure. The current VAC anti-cheat system fails to provide sufficient protection against cheating activities, and I've experienced this in 4/5 games I've played this week alone. It's amazing how many cheaters there are! 

I do think that the game requires dedicated servers with active administrators to manage gameplay and create a balanced competitive environment. The game shows promise but it deviates from the traditional Counter-Strike gameplay that true fans of the game know and love.",0,neutral,0.5500109195709229,0,2025-09-02 21:13:10+00,2025-09-18 15:32:42.097339+00
730,Counter-Strike 2,"Good shooter good skins but there are to less other game modes and to many ai players and cheater :( 
Plus they never get banned.
Now my question is valve condoning cheater because you do nothing against it? Sad world actually",-0.9030044674873352,negative,0.9030044674873352,0,2025-08-29 17:44:25+00,2025-09-18 15:32:42.185039+00
730,Counter-Strike 2,"I recently created this Steam account just to play CS2 with some friends. They told me I needed to reach level 10 first, and I thought, ""Alright, that shouldn’t be too hard.""

Unfortunately, Valve makes this process extremely frustrating. I'm constantly being matched either with obvious cheaters or players who have been around since 2015/2016 and have way more experience than me. The cheaters are often blatant, yet nothing happens to them — VAC seems to completely ignore it.

If you want to play with friends, your only real option is to use an older account. But if you don’t have one yourself, you'd have to buy one or get it from someone else — which is clearly against the Terms of Service and can lead to a ban.

So you're left with two bad choices: play in unfair matches full of cheaters, or risk a hardware ban by trying to bypass the system. At this point, I honestly understand why some players are willing to take that risk.

The way new CS2 players are treated is extremely disappointing. It feels like Valve is completely ignoring how broken the early experience is. As someone just trying to enjoy the game with friends, it's really discouraging.",0,neutral,0.632275402545929,0,2025-09-08 15:52:13+00,2025-09-18 15:32:42.50081+00
730,Counter-Strike 2,"Honestly I'm not happy with the state of Counter strike, regarding current connectivity. its honestly unplayable. unfair. It's problematic enough that it needs to be addressed.

I play Counter-Strike for its core fundamentals that never change, you adapt. you work around player-skill, unlike present day games sanitised for mass adoption, often replicated and without true character. Counter-Strike is the game that I know, i want to invest into, that scratches my competitive itch.

that being said.

The connectivity issues make Counter-Strike, Completely unjustifiable. with basic logic you would expect a competitive title to ensure the best servers, a high standard. but it seems its the opposite.

there is no obligation for an answer from Valve themselves, but I personally feel its deserved, with how much I invest into this game. and I think others might feel that way too.

feel free to express what you think below, I'm open to all, I just believe this needs to be addressed. and with how much of a headache this has caused me.",-0.663384735584259,negative,0.663384735584259,0,2025-08-19 03:31:14+00,2025-09-18 15:32:42.740892+00
730,Counter-Strike 2,"Valve matchmaking absolutely unplayable. I love this game, i play it since my childhood. Its pain to see, how Valve does nothing, to make it more safe and enjoyable for their community. Im sticking to FACEIT, they dont mind helping, or actually doing something they have and need to. M1",-0.7567291855812073,negative,0.7567291855812073,0,2025-09-09 17:11:54+00,2025-09-18 15:32:42.852821+00
730,Counter-Strike 2,"this game is amazing! it has a great community that's not toxic at all, they are always ready to help you. plus, it's a game without cheaters. i definitely recommend it",0.9791379570960999,positive,0.9791379570960999,0,2025-09-02 17:43:01+00,2025-09-18 15:32:42.968262+00
730,Counter-Strike 2,"ppl suffer by hackers in premier unlucky xdddd 
respect to faceit and my condolences to the rest",-0.8980525135993958,negative,0.8980525135993958,0,2025-09-06 17:51:46+00,2025-09-18 15:32:43.061653+00
730,Counter-Strike 2,"whatever these genesis terminals are, they are absolutely terrible and an extra step to convolute just buying a skin straight up to keep up with the illegal skin trading scene. dont get me wrong i like lootboxes and love opening my weekly, this ""genesis terminal"" bull shit is fucking stupid.",-0.9121589064598083,negative,0.9121589064598083,0,2025-09-17 03:45:01+00,2025-09-18 15:32:43.173439+00
730,Counter-Strike 2,games dog doodoo valve needs to figure out 50% of the player base is cheating and find some real anti cheat this is a joke you can't code one so buy one everyone working for u is a clown.,-0.9492253065109253,negative,0.9492253065109253,0,2025-09-06 07:11:11+00,2025-09-18 15:33:13.375883+00
730,Counter-Strike 2,"Nothing but Cheaters, Smurfs, and trolls.... yet i continue to play this game because im addicted....",-0.7182741761207581,negative,0.7182741761207581,0,2025-09-10 18:38:03+00,2025-09-18 15:33:13.464091+00
730,Counter-Strike 2,So back when it was csgo it felt way better but then they got cs2 i mean its def not csgo but I mean they are working on it. I still think there is more to be done and make the game better so hopfully they can get it back at its peek game play I will always enjoy this game the raging and all that but honestly. Its and alright game but still needs to be improved.,0.6684284806251526,positive,0.6684284806251526,0,2025-09-13 17:13:49+00,2025-09-18 15:33:13.595803+00
730,Counter-Strike 2,"Good game,anti-cheat still needs improvements and the trust factor system has to be repaired i report hackers,play with no hacks after 3 days red trust factor like cmon whaaatt",0.6639150381088257,positive,0.6639150381088257,0,2025-09-11 08:58:24+00,2025-09-18 15:33:13.681945+00
730,Counter-Strike 2,Super fun game and there are so many friendly players who are always encouraging and nice! 👍✌,0.9872167706489563,positive,0.9872167706489563,0,2025-09-09 11:54:41+00,2025-09-18 15:33:13.755978+00
730,Counter-Strike 2,fun game if u tryna lock in w the bros and play competitively,0.8239469528198242,positive,0.8239469528198242,0,2025-09-08 03:37:43+00,2025-09-18 15:33:13.83642+00
730,Counter-Strike 2,"---{ Gameplay }---
☑ 1 tap headshot  
☑ Teammate yelling in Russian  
☑ Losing 13-0  
☑ Still queueing again",-0.6538114547729492,negative,0.6538114547729492,0,2025-09-07 16:33:07+00,2025-09-18 15:33:13.930053+00
730,Counter-Strike 2,I love how this game’s anticheat is so bad that I can cheat easily without ever getting banned. I love cheating in CS2.,0.5742591023445129,positive,0.5742591023445129,0,2025-09-06 20:43:44+00,2025-09-18 15:33:14.023785+00
730,Counter-Strike 2," Absolute Perfection – CS2 is More Than a Game, It’s My Life

Counter-Strike 2 isn’t just an upgrade — it’s a revolution. From the moment I launched it, I knew this was something special. The visuals? Crisp, immersive, next-level. The smoke grenades that now dynamically flow with the air? The reimagined maps with stunning detail? The lightning-fast netcode that makes every flick shot feel just right? Valve didn’t just update a game — they rebirthed a legacy.

I’ve poured hundreds of hours into CS over the years, and CS2 feels like the game I’ve always dreamed of. Whether I’m clutching out a 1v5 on Mirage, dropping a perfect flash on Dust II, or coordinating with my team in competitive, every match is pure adrenaline. The sound design is so precise I can tell an AWP shot from a scout just by the echo. The balance? Flawless. The community? Still the most intense, passionate group of players in gaming.

I play almost every day — with friends, in ranked, in deathmatch just to warm up. CS2 has brought me closer to my squad, challenged my mind, sharpened my reflexes, and given me memories I’ll never forget. That ace with the M4? The knife flick that shut down the round? Pure magic.

Thank you, Valve, for not just preserving what made Counter-Strike legendary, but for evolving it with such care and precision. This isn’t just my favorite shooter — it’s my obsession. CS2 isn’t just worth every penny… it’s priceless.

Long live Counter-Strike.",0.9580864310264587,positive,0.9580864310264587,0,2025-09-04 10:53:06+00,2025-09-18 15:33:14.477663+00
730,Counter-Strike 2,Best game ever zero cheaters thanks to Vac Live Secure Servers,0.9405497312545776,positive,0.9405497312545776,0,2025-09-03 20:13:30+00,2025-09-18 15:33:14.569218+00
730,Counter-Strike 2,"VAC = Valve Allows Cheats. Don’t try to play this piece of bullshit, because you’ll just get destroyed by cheaters, while Valve moves one box on a random map and calls it a HUGE MASSIVE UPDATE. Don’t repeat my mistakes, guys.",-0.9430397152900696,negative,0.9430397152900696,0,2025-09-02 18:46:22+00,2025-09-18 15:33:44.799382+00
730,Counter-Strike 2,"Counter-Strike 2 isn’t perfect, but let’s be honest: neither was CS:GO, and we still sank thousands of hours into it. CS2 takes the foundation we already love — the tension of a 1v3 clutch, the deafening sound of a perfectly timed flash, the dopamine hit of an eco round win — and brings it into a new era.

What works:

- Gunplay feels crisp. Tapping heads with the AK never gets old, and spraying still takes actual skill instead of RNG praying.

- Smokes are next-level. Dynamic, volumetric, reactive. Shooting or throwing nades through them is a game-changer. Feels like CS, but evolved.

- Source 2 glow-up. Maps are brighter, cleaner, and easier to read. Even classic Mirage feels like a fresh experience.

- Matchmaking is faster. I’m queuing with friends in minutes instead of waiting in limbo.

- Same heart-pounding clutch moments. When it’s down to you, the bomb, and 3 enemies hunting you — nothing else in gaming compares.

What doesn’t (yet):

- Performance can dip on mid-tier rigs. Source 2 looks gorgeous, but it eats weaker PCs for breakfast.

- Some sound bugs and netcode quirks still pop up — classic CS experience, honestly.

- The community… is still the community. But that’s part of the charm, right?

At its core, CS2 is still Counter-Strike: brutal, rewarding, and endlessly replayable. It’s a free upgrade, it already feels like home, and despite the rough edges, it’s the best version of CS we’ve had in years.

If you’ve ever shouted “rush B” with your friends at 3 AM, you’ll feel right at home here.",0.548107385635376,positive,0.548107385635376,0,2025-08-26 03:19:40+00,2025-09-18 15:33:45.440271+00
730,Counter-Strike 2,"Now i can be even more toxic in a video game yippie!
Such a nice game im better at CS than in Valorant lol
But a lot of russians is a minus oh",0.435910701751709,positive,0.435910701751709,0,2025-08-25 20:00:42+00,2025-09-18 15:33:45.542148+00
730,Counter-Strike 2,Really bad game ass tickrate ass everything most hits dont register shots go through bodies and you aint got servers in eastern europe i always play with 80ping and my enemy always has less than 20 im not moving countries cause you cant make a game properly and for once valorant at least has servers near eastern europe go fix the servers for the love of god the ad says ''what you see is what you get'' what kind of bullshit crap is that bro i see blood on the wall then i watch replay and it shows i never shot fix the tickrate and add Eastern Europe servers and fix your ass anti cheat where you see people spinbotting around maps you cant go 5 matches without seeing at least one cheater,-0.9443030953407288,negative,0.9443030953407288,0,2025-08-23 08:47:26+00,2025-09-18 15:33:45.73196+00
730,Counter-Strike 2,Ideal game if you want to master gambling while watching your wallet vanish. Absolutely worth a try!,0.9066437482833862,positive,0.9066437482833862,0,2025-08-20 05:25:33+00,2025-09-18 15:33:45.82647+00
730,Counter-Strike 2,The new free case drop is not a free case at all. you have to pay for the skin you pull. give us an operation you lazy developers you have so much money and you do not put it back into the game.,-0.8662446141242981,negative,0.8662446141242981,0,2025-09-17 02:16:27+00,2025-09-18 15:33:45.952565+00
730,Counter-Strike 2,"What stood out most about this game was that you needed hand-eye coordination to be good at it. You needed real skill. Since CS2, and even more so now with the latest updates, you aim for the chest and the bullet ends up in the head. In real life, bullets slow down and fall, but rise? That doesn't happen. At least in Valorant, it makes sense that the aim is assisted. I can no longer recommend it as a good game. And let's not even talk about the astronomical number of cheaters there are, even in Prime, or the bugs, where weapons disappear and the crosshairs remain as a black block of pixels on the screen...  ""Mi vieja mula ya no es lo que era""

It seems like there are more cheaters than before, but in reality what there is is a better (not necessarily a good thing) aiming and bullet redirection assistance system.",-0.47266969084739685,negative,0.47266969084739685,0,2025-08-28 05:20:12+00,2025-09-18 15:33:46.194842+00
730,Counter-Strike 2,i met alot of russians and they call me sus names such as негр and i think they mean im there friend so banger game would recommend,0,neutral,0.5294988751411438,0,2025-08-28 23:28:02+00,2025-09-18 15:33:46.301148+00
730,Counter-Strike 2,"My dear friends
I suggest you can play this game everyday and enjoy it and sometimes get your pressure rise xD",0.8878570199012756,positive,0.8878570199012756,0,2025-09-15 01:36:01+00,2025-09-18 15:33:46.39139+00
730,Counter-Strike 2,"Full of cheaters as usual, valve will never do anything about it.",-0.9216436743736267,negative,0.9216436743736267,0,2025-09-13 15:46:26+00,2025-09-18 15:33:46.470252+00
730,Counter-Strike 2,"I played in Premier after buying prime and all that.
The community is Toxic, Valorant sucks too.
I don't know both communities are toxic in their own right.
In CS2 everyone just calls you a ""retard"" in premier or a ""nigger"" in chat. The game is infested with hackers.
Every person in the game feels like they're on drugs and just hates themselves and everyone around them.

I kind of looked up to the old pros when I was young and just thought I could spend a couple thousand hours in this game like I would with any other.
I miss when shooters were fun, now it just feels like every third world country lunatic was put in a room with pillows and pretends to be a heavy weight UFC champion with their secret weapon being to throw their own feces at one another.

And they call that a game.

I'm too tired to pier review my own review I guess.

Don't play this game, I feel like the majority of people who play this game are similar to Andrew Tate consumers.
It just sucks man there's no fun.

Face it is no better, I tried a couple games and it was awful. At least in low ELO no one talks, and the ones that do just don't want to hear anything from you because they're just stuck in their own heads.

When you do try to start a conversation or give clear comms they blame you for doing something wrong, or if you make a mistake they call you trash for the rest of the game.
""Retard"" this ""Nigger"" that and so on and so forth.

I grew up learning that gaming was a safe haven for shut ins like me and stuff.
This is probably the opposite. Everyone just thinks they're hot shit and they talk about rape and violence and doing drugs and shit.
If it's not that then it's probably just half assed depressed 50 year old dads trying to relive what used to be probably a good game.

anyway good night, don't play the game not worth the time

play minecraft by yourself and try to learn how to build things or maybe go learn law so you can get a cut of that Roblox shit whenever that Bazuki idiot CEO or whatever offs himself
He was probably on the island.

that's like 1000x easier than playing this game ever",-0.8186325430870056,negative,0.8186325430870056,0,2025-08-20 10:59:43+00,2025-09-18 15:34:17.274736+00
730,Counter-Strike 2,"Quite an old game, good to see it come to this stage; 
But going more towards skins and shit instead of necessities like better security, optimization, and more.
With every update, raising bar for minimal hardware also.
",0.6744255423545837,positive,0.6744255423545837,0,2025-09-03 09:27:09+00,2025-09-18 15:34:17.378412+00
730,Counter-Strike 2,don't play unless you cheat because everyone cheats and ruins the game,-0.8606749773025513,negative,0.8606749773025513,0,2025-08-28 00:51:01+00,2025-09-18 15:34:17.457178+00
1172620,Sea of Thieves,"---{ Graphics }---
☐ You forget what reality is
☑ Beautiful
☐ Good
☐ Decent
☐ Bad
☐ Don’t look too long at it
☐ MS-DOS

---{ Gameplay }---
☑ Very good
☐ Good
☐ It's just gameplay
☐ Mehh
☐ Watch paint dry instead
☐ Just don't

---{ Audio }---
☐ Eargasm
☑ Very good
☐ Good
☐ Not too bad
☐ Bad
☐ I'm now deaf

---{ Audience }---
☐ Kids
☑ Teens
☑ Adults
☐ Grandma

---{ PC Requirements }---
☐ Check if you can run paint
☐ Potato
☐ Decent
☑ Fast
☐ Rich boi
☐ Ask NASA if they have a spare computer

---{ Game Size }---
☐ Floppy Disk
☐ Old Fashioned
☑ Workable
☐ Big
☐ Will eat 15% of your 1TB hard drive
☐ You will want an entire hard drive to hold it

---{ Difficulty }---
☐ Just press 'W'
☐ Easy
☑ Easy to learn / Hard to master
☐ Significant brain usage
☐ Difficult
☐ Dark Souls

---{ Grind }---
☐ Only if u care about leaderboards/ranks
☐ Isn’t necessary to progress
☐ Average grind level
☐ Too much grind
☑ You’ll need a second life for grinding

---{ Story }---
☐ No Story
☑ Some lore
☐ Average
☐ Good
☐ Lovely
☐ It'll replace your life

---{ Game Time }---
☐ Long enough for a cup of coffee
☐ Short
☐ Average
☑ Long
☐ To infinity and beyond

---{ Price }---
☐ It's free!
☐ Worth the price
☑ If it's on sale
☐ If u have some spare money left
☐ Not recommended
☐ You could also just burn your money

---{ Bugs }---
☐ Never heard of
☐ Minor bugs
☐ Can get annoying
☑ ARK: Survival Evolved
☐ The game itself is a big terrarium for bugs

---{ ? / 10 }---
☐ 1
☐ 2
☐ 3
☐ 4
☐ 5
☐ 6
☐ 7
☐ 8
☑ 9
☐ 10",0,neutral,0.5906234979629517,0,2025-08-21 10:54:07+00,2025-09-18 15:34:18.211165+00
730,Counter-Strike 2,"At this point, it is obvious that Valve is more concerned with catering to its 2% SteamOS base, than providing an efficient anti-cheat for the community at large.",-0.6828924417495728,negative,0.6828924417495728,0,2025-09-09 02:14:38+00,2025-09-18 15:34:18.295602+00
