app_id,game_name,review_text,sentiment_score,sentiment_label,sentiment_confidence,review_helpful,review_timestamp,processed_timestamp
1172620,Sea of Thieves,very fun game. however theres bugs and some cheating players and annoying players.,0.4315381944179535,positive,0.4315381944179535,0,2025-09-06 17:45:12+00,2025-09-18 15:42:43.594252+00
1172620,Sea of Thieves,i don't know how i have this game i didn't buy was intrested in playing went to the store and saw it was 40 bucks and ima now not play it cuz i dont like games that are wayyyyy to exspensive,-0.9225953817367554,negative,0.9225953817367554,0,2025-09-06 14:30:04+00,2025-09-18 15:42:43.720392+00
440,Team Fortress 2,"Ive only been playing this game for about a year, and I absolutely adore and love it to death. 

From the game itself, to the community creations (SFMs, cosmetics) I find a deep inspiration that no other game provides.

When I first joined, it was constantly emphasized how I was “late to the party” because this game lacks proper updates for over seven years now. But I still find myself incredibly attached and involved. TF2 is the kind of game that doesn’t need updates to live on, and is instead propelled forward by the community around it. This game has a lot of fight in it and an even bigger army of fans behind it. I hope to see it prosper on now and in the far future.

Love you all, and thanks for all the summer crates.",0.9774226546287537,positive,0.9774226546287537,0,2025-08-26 03:03:40+00,2025-09-18 15:42:43.963064+00
271590,GTA V,"I got locked out of this game because somehow wrong nonexistant rockstar account got linked to steam, and now it doesnt give me the option to put a proper account.
Cant play the game I paid for.
Negative review from me",-0.9343748092651367,negative,0.9343748092651367,0,2025-09-14 16:26:28+00,2025-09-18 15:42:44.088805+00
1172620,Sea of Thieves,"One of the most beautiful games I've ever played. Love the freedom, themes and stories you can explore!",0.986236035823822,positive,0.986236035823822,0,2025-09-06 11:52:18+00,2025-09-18 15:42:44.187129+00
1172620,Sea of Thieves,The black powder barrels are just ridiculous on how touchy they are just trying to get them off your ship can cause detonation . The amount of cheaters is getting out of hand and lag is your friend just over it.,-0.9377473592758179,negative,0.9377473592758179,0,2025-09-05 23:02:40+00,2025-09-18 15:42:44.365328+00
1172620,Sea of Thieves,"please help i stuck on loading supply (ghostbeard) i was reinstal this game 3 time, but didnt work, please help",-0.8474184274673462,negative,0.8474184274673462,0,2025-09-05 02:23:01+00,2025-09-18 15:42:44.462321+00
440,Team Fortress 2,"Everyone is scared that their favourite games will die, but no one bats an eye when these games slowly become shtholes.

In other words:
""You either die a hero or live long enough to see yourself as a villain.""


P.S. I've never played TF2 before the MYM update.",-0.8211755752563477,negative,0.8211755752563477,0,2025-09-17 13:28:10+00,2025-09-18 15:42:44.592627+00
440,Team Fortress 2,"The game's gotten to a point where every lobby is full of Australium-wielding players that always have 10k hours on the game. You wanna be good at the game? Invest. Invest. Invest.
Game is comical in its own right, and competitive in others. I remember when Casual used to be fun and I'd be on the winning team when we were evenly matched or otherwise. But now, the game has devolved into whichever team has the most 10k hours players on their team.
I just can't recommend it anymore. Friendly players will be mad at this review bc it's Team Fortress we're talking about, competitive players will be mad at this review because all they can say is ""get good like me, oh wait HAHA"". It's not fun anymore. I quit.",-0.5737703442573547,negative,0.5737703442573547,0,2025-09-08 06:25:38+00,2025-09-18 15:43:14.839151+00
440,Team Fortress 2,"I'm not doing this any more this game has made me break more screens than any other, FUCK THIS UNBALANCED PIECE OF SHIT.",-0.9599561095237732,negative,0.9599561095237732,0,2025-09-08 21:54:20+00,2025-09-18 15:43:14.926446+00
271590,GTA V,"Worth for the story, but not the online. It's tedious, grindy and not fun unless you throw real cash at it.",-0.8005664944648743,negative,0.8005664944648743,0,2025-09-14 16:25:19+00,2025-09-18 15:43:15.024384+00
1172620,Sea of Thieves,"After having played a thousand hours on this game, I can say there is no other experience like it. The amount of interactions you can have with other people, the great and adrenaline filled moments and the stories you can tell after a great voyage are enough to satisfy anyone! 

Rare has hit the ball out of the park with this game and couldn't recommend it more to anyone!",0.9831478595733643,positive,0.9831478595733643,0,2025-09-04 16:32:10+00,2025-09-18 15:43:15.168361+00
440,Team Fortress 2,"This game was awesome at the beginning but now i'ts just a big mess of everything (too much options, less core fun), mixed with steam micro ransactions... WTH happened!",-0.808287501335144,negative,0.808287501335144,0,2025-08-27 23:59:13+00,2025-09-18 15:43:15.289045+00
271590,GTA V,"A gaming classic.

Singleplayer is a blast, fair warning the online play is incredibly toxic.",0.6696954965591431,positive,0.6696954965591431,0,2025-09-09 18:18:05+00,2025-09-18 15:43:15.384413+00
1172620,Sea of Thieves,"Fun gameplay loop, but not for Single Player/New Players.
2 Hours into a quest and some looting in a private game (for newbies), only to be killed by bots who are really tryhard - to the point of using special cannonballs that DROP YOUR ANCHOR - and have ALL the progress reset because the ship got destroyed.",-0.8752158880233765,negative,0.8752158880233765,0,2025-09-04 15:51:17+00,2025-09-18 15:43:15.534779+00
1172620,Sea of Thieves,Good game,0.8792710304260254,positive,0.8792710304260254,0,2025-09-04 13:18:21+00,2025-09-18 15:43:15.590267+00
271590,GTA V,"Yet another game I can no longer play due to back-end manipulation by a company well known for terrible support. The game is insisting I do not have the correct Rockstar Games login, leading me to some email that I have never seen before. Any and all attempts to fix this have not worked. Thanks for the waste of money and time.",-0.9377217888832092,negative,0.9377217888832092,0,2025-09-09 19:46:36+00,2025-09-18 15:43:15.739288+00
440,Team Fortress 2,"I played this quite a lot a long time ago. Came back once in a while. But after coming back one final time I can comfortably say that this game is not meant for casual play. It isn't. It is meant for folks who play this regularly. If you do not play this regularly, you will lose a lot and die a lot. You will feel useless and unable to really to anything noteworthy for your team, assuming you can leave spawn without dying.

I now understand why this game was plagued with bots way back when. It's an old game. Maybe it's time to move on.",-0.7275670766830444,negative,0.7275670766830444,0,2025-09-03 06:24:13+00,2025-09-18 15:43:15.911678+00
1172620,Sea of Thieves,"Its a pretty fun game for sailing out with a bunch of friends (solo is also fine, but I find it gets repetetive and boring far slower if you play with others) and go on little adventures on the seas and a bunch of pretty cool islands together. It includes a set of mechanics that are very easy to learn but hard to master. Everybody has identical gear and almost all progress is pretty much cosmetic after you unlock captained ships, so in theory every crew has a fair shot in PVP and grinding is possible but not at all necessary. That being said, there are a lot of sweats playing the game 24/7 with insane PVP-strategies and skillsets that are absolutely going to obliterate anybody remotely new to the game. Its all about piracy, so your loot is never really your loot until you sold it off and, if youre playing high-seas, you should get ready to get into a bunch of interactions with other players. Some of them are really friendly and helpful, others just want to see the world burn and steal your stuff. For new players, I would definetly advise to play with more experienced friends or first start of in safer seas to get a feel for the game. Being constantly sunk during grinding can be annoying, but the chance of it happening can be massively decreased by gaining some experience first and playing more. If youre just looking for a fun time and dont worry about playing a bunch to get better, I would strongly advise not to play solo or just go to safer seas if you have a low tolerance for frustration by losing progress. I personally love the game, but I heard from a couple of people that they were annoyed at the possibility of losing rewards for multiple hours of grinding, so just know what you want and dont want to get into.",0.6741278767585754,positive,0.6741278767585754,0,2025-09-04 03:14:17+00,2025-09-18 15:43:46.382889+00
271590,GTA V,"the game isbeing stupid and not loading and cannnot ffix this problem.
",-0.9410569667816162,negative,0.9410569667816162,0,2025-08-20 21:54:43+00,2025-09-18 15:43:46.463416+00
440,Team Fortress 2,"Este juego está acabando conmigo lentamente. 










Y me gusta",0,neutral,0.8048040866851807,0,2025-09-02 16:45:05+00,2025-09-18 15:43:46.556299+00
1172620,Sea of Thieves,"UPSIDE: 

This game is overall very nice and worth trying. Graphics are beautiful soundtracks likewise. Gameplay is thrilling with plenty of things to do all the time and it can make you busy for hundreds of hours. Therefore its worth the money.

Consider that you need to be at least team of 2 for this game to be enjoable. More the better. Solo experience is rather hardcore. You can go with random open crew but its very chaotic for most of the time.

75% of community is also very nice. You can meet people and have nice chat, cooperation or fight . Whatever you want.

DOWNSIDE:

Remaining 25% of population. People with thousands of hours and nothing to do I guess? Chasing players around for mostly nothing. Thats where most negative reviews about this game came from I think. If they just hunted you down, sunk your ship and took your stuff, it would be fine I guess since its the pirate game in the end. However they will just spawnkill you on your boat. For unlimited ammount of time if you dont change server. I believe that if someone just started with the game and is lucky enough to encounter this several times during his first day, he is done with the game for good at that point. 

There is a pure PVP mode but being 3v2 or 4v1 etc. and killing guy over and over before he can even load the game after revive is somehow more uplifting and ego boosting for some individuals than real challenge.

",0.9294149875640869,positive,0.9294149875640869,0,2025-09-03 23:16:48+00,2025-09-18 15:43:46.962291+00
271590,GTA V,"Why would i want to give you kernel level control of my computer wtf. Figure out a different way to deal with your online cheaters... I payed for this game I expect to be able to play it as i always have without you having the ability to do what ever you want with my system, and saying we are not interested in your stuff is not an excuse its saying if something bad happens it wasn't us.",-0.8756401538848877,negative,0.8756401538848877,0,2025-08-19 14:06:07+00,2025-09-18 15:43:47.104285+00
440,Team Fortress 2,By far the worst game i ever played. Fricking random crits. This game sucks,-0.9651350975036621,negative,0.9651350975036621,0,2025-08-24 09:17:03+00,2025-09-18 15:43:47.196377+00
440,Team Fortress 2,im not even mad at it anymore its just a constant aura of misery every time i give it a second chance like please  seriously how are you supposed to have fun here,-0.9077813029289246,negative,0.9077813029289246,0,2025-09-05 10:33:27+00,2025-09-18 15:43:47.30475+00
440,Team Fortress 2,"i love this game,i do not care what people say this is the best shooter in the world",0.9797287583351135,positive,0.9797287583351135,0,2025-08-31 19:35:15+00,2025-09-18 15:43:47.402322+00
1172620,Sea of Thieves,"""Alright, so there's your ship, here, have some resources and go sail""- the game.
This game is pretty cool in multiples aspects. The grafics and the style are greats. The quest are fine and the battles aren't bad. The best thing of all is being on a mission with your dudes. It has a few issues, but it's so entertaining and funny. 
The game is made with love after all, and you can tell. Maybe less paid customising content and new quests or an ice zone for example would be a great idea for a next season.
8/10",0.9509503841400146,positive,0.9509503841400146,0,2025-09-03 14:20:15+00,2025-09-18 15:43:47.584987+00
271590,GTA V,"fucking stupid server services, fucking dick launcher, idiot developers",-0.9619850516319275,negative,0.9619850516319275,0,2025-09-17 17:10:02+00,2025-09-18 15:43:47.674343+00
440,Team Fortress 2,This game hit me during covid like crack hit poor neighborhoods in the 80s.,-0.6723816394805908,negative,0.6723816394805908,0,2025-08-20 20:29:42+00,2025-09-18 15:44:17.798544+00
1172620,Sea of Thieves,"A game that can fit any playstyle and can create some great laughs but also great despair.

In my opinion the game is fun, I love exploring the seas and doing quests to come back with a big hoard to sell for profit to then use that gold to get myself some fancy new cosmetics. It's especially fun with a friend- up to 3 friends even! No matter if trilling gameplay or roleplaying as a pirate with friends is your cuppa tea- you will likely find your place on the Sea of Thieves.

The game is also actively being updated with rather big updated often with the seasons, also offering an optional battle pass, only locking cosmetics behind it. No weapons are ever locked behind any unlocks, you will always have access to all weapons and tools, just the skins are unlockable.

Though the game doesn't come without a mayor flaw though in my eyes; The fact you have to play it always online to make any progress in commendation or the other 90% of what the game has to offer- Despite playing the game for over 1000h at the time of writing; I still don't play every day and play more casually with friends who may not even have more than 50h in the game yet. 

The fact it's always online means there's a high chance for you to just randomly get attacked by another crew; part of the game I know- but being chased for hours while just trying to do a Story Quest or simply trying to have fun with my partner is not a great experience for anyone involved. The fact it's other players also means that usually, the ones attacking are people who play the game often enough to just utterly destroy casual players- meaning it feels somewhat unfair to go against these kinds of people at times, where you spend hours exploring, collecting loot, just for it to be taken away by a crew of 3 who played the game religiously and know every trick in the book.

There is a ""Safer Seas"" option in the game, but it doesn't allow for most commendations, trading company flags, etc. basically locking you out of rather important content.

It doesn't ruin the full game for me personally, but I would honestly enjoy some solution where you can just play the game at your own pace without the sweats comin for your ass because you dug up a Reapers Bounty randomly or they simply saw a flag on the horizon-

Great game, though try and get a hang of PVP rather quick or you will most likely get your loot plundered often, often making you quit the game in a rather upset mood, especially with how toxic some players can get against newer crews.",0.8466084599494934,positive,0.8466084599494934,0,2025-09-03 13:26:48+00,2025-09-18 15:44:18.581585+00
271590,GTA V,Im recommend this for kids because this game is so family friendly and go to the heel icon to buy the best shoes for only 40$,0.9772726893424988,positive,0.9772726893424988,0,2025-09-17 07:32:53+00,2025-09-18 15:44:18.682951+00
440,Team Fortress 2,"Игра, где можно быть добрым путисом, или блекбоксером",0,neutral,0.8069751858711243,0,2025-08-25 16:09:42+00,2025-09-18 15:44:18.813769+00
1172620,Sea of Thieves,"Sea of Thieves is an amazing game both for Solos or if you want to play w friends. However I will say that the game is most enjoyable with friends since honestly speaking thats the main design of the game. That youre pirate w your own pirate crew. Pillaging and exploring the sea of thieves its an amazing experience. Although I did say that you can enjoy the game as a solo it wasnt a lie. I currently have almost 130 hours on the game all solo, maybe 2 hours w a random person i met within the game but mainly solo. The one thing I will point out tho is that if youre hoping to sail the seas w a big galleon type ship you see within the game or in movies, yeah no its not gonna happen as a solo. As a solo youre really only able to get on the sloop to not get obliterated by other pirates that actually have a crew. You can still choose to sail with a galleon ship as a solo just not recommended. Honestly speaking its an enjoyable experience overall but again pointing out youll get the maximum experince of the game playing w youre friends vs playing alone. All in all a solid game i give it an 8/10 totally recommend. (mind you this game came out 5 years ago not an old game but neither a recent game a solid game thats currently doing still pretty well aside from the pvp sweats issue but thats honestly any multiplayer game nowadays)",0.9619724750518799,positive,0.9619724750518799,0,2025-09-03 09:16:45+00,2025-09-18 15:44:19.181658+00
271590,GTA V,"It's a great game and the story plus the online it's crazy and it's bean out for 12 years and still getting updates
",0.9737480878829956,positive,0.9737480878829956,0,2025-09-16 20:47:46+00,2025-09-18 15:44:19.282264+00
440,Team Fortress 2,i got insulted by 5 russians holding porn signs at my face. 10/10 game,-0.8870204091072083,negative,0.8870204091072083,0,2025-09-02 17:34:47+00,2025-09-18 15:44:19.363634+00
440,Team Fortress 2,"after all these years, still fun to pop in and play a few rounds",0.8879668116569519,positive,0.8879668116569519,0,2025-09-16 17:11:06+00,2025-09-18 15:44:19.436005+00
440,Team Fortress 2,"I currently owe Merasmus 22 bucks and a singular piece of reclaimed metal, I also can't seem to find my wallet, if anyone knows where it is let me know.",-0.9181180596351624,negative,0.9181180596351624,0,2025-09-02 19:30:58+00,2025-09-18 15:44:19.529561+00
1172620,Sea of Thieves,"One of my favorites! It's just too good, even if you play solo or with friends you won't get bored! Loved every single thing about it",0.9869043231010437,positive,0.9869043231010437,0,2025-09-03 07:04:11+00,2025-09-18 15:44:19.616541+00
1172620,Sea of Thieves,"Amazing, little hackers, fun gameplay, fun lore, fun fights.",0.9821460843086243,positive,0.9821460843086243,0,2025-09-02 23:17:31+00,2025-09-18 15:44:49.75816+00
440,Team Fortress 2,FUCK THIS GAME ITS NOT NOOB FRIENDLY IT MADE ME STOP PLAYING FOR 2 YEARS DUE TO HOW BAD IT WAS FUCK YOU VALVE FUCK YOU!!!,-0.963322103023529,negative,0.963322103023529,0,2025-09-02 05:04:31+00,2025-09-18 15:44:49.872401+00
271590,GTA V,"The game is great , but I can't play it anymore because the damn launcher is in an endless update , and now I regret buying this game because I can't access it",-0.915818989276886,negative,0.915818989276886,0,2025-09-16 18:21:06+00,2025-09-18 15:44:49.977413+00
1172620,Sea of Thieves,"Another game I have played since near release on console but the game just seemed to quickly die out of no where. You used to only get full lobbies of players on a balanced variety of ships but now, you will only really find 1 or 2 ships in a whole lobby and its usually just a group of 10k hours in a galleon with thousands of resources on their ship making them unsinkable. All this game really needs again is players, apart from that it is still a good game 7/10",-0.714566171169281,negative,0.714566171169281,0,2025-09-02 23:14:48+00,2025-09-18 15:44:50.13633+00
440,Team Fortress 2,over one hundred hours ingame and i still dont know how to rocket jump,-0.7588324546813965,negative,0.7588324546813965,0,2025-09-16 20:56:34+00,2025-09-18 15:44:50.229653+00
440,Team Fortress 2,I've been playing this game (and its predecessor Team Fortress) for about 25 years. 'nuff said.,0.5781272649765015,positive,0.5781272649765015,0,2025-09-04 10:10:31+00,2025-09-18 15:44:50.334481+00
1172620,Sea of Thieves,"this game is pure pirate crack every session starts normal like “aye let’s do a voyage” and five minutes later jimmy’s drunk puking on the map table sarah fell off the boat again and i’m blasting shanties while steering us full speed into a rock

the 2025 edition adds new toys fancy sails shinier hats bigger explosions more ways to ruin your social life it’s beautiful
but then they dropped the smugglers league which makes no sense at all like why are we pretending there are laws to break in a game where i can literally eat a banana in front of a kraken while firing my buddy out of a cannon onto a skeleton’s face smugglers in a lawless pirate world is like inventing jaywalking tickets in gta it’s cute but dumb

best part tho is still the chaos like spending 2 hours hauling treasure like it’s your retirement fund then a 12 year old in a dinghy rolls up calls you trash and blows your ship sky high
i cried laughed reinstalled and did it again

pros

drunk simulator 2025

ship battles that feel like family fast and furious but wet and angry

treasure dopamine hits harder than caffeine

cosmetics so good you’ll sell your soul for a fancy coat

cons

smugglers league update is like putting handcuffs on a kraken pointless and weird

i keep saying “yar” in real life people think i’m broken

seagulls now trigger my fight or flight

10/10 would drown chasing a chest again",-0.74881511926651,negative,0.74881511926651,0,2025-09-02 20:05:45+00,2025-09-18 15:44:50.821299+00
271590,GTA V,The classic GTA experience. Good to replay it again after so many years.,0.9721285700798035,positive,0.9721285700798035,0,2025-09-16 05:57:04+00,2025-09-18 15:44:50.949279+00
271590,GTA V,"incredibly fun, but the user experience and UI is absolutely dreadful. Worst I have ever used. I have never got this frustrated trying to accomplish basic things. Playing with friends is incredibly fun however",-0.8626369833946228,negative,0.8626369833946228,0,2025-09-16 04:43:32+00,2025-09-18 15:44:51.110747+00
271590,GTA V,Absolutely bricked for the past few months. Rockstar has been no help to anyone with the issue including me.,-0.9254512786865234,negative,0.9254512786865234,0,2025-09-16 02:48:48+00,2025-09-18 15:44:51.240701+00
440,Team Fortress 2,This game was my childhood. Still have the proof of purchase.,0.9148737192153931,positive,0.9148737192153931,0,2025-08-29 02:41:05+00,2025-09-18 15:45:21.402309+00
440,Team Fortress 2,toxic and funny,0,neutral,0.4575277268886566,0,2025-08-26 16:32:58+00,2025-09-18 15:45:21.490754+00
271590,GTA V,This game is no fun at all! if you roam around! some players like high level just bully you! I can't even play to appreciate the game itself!,-0.9579154253005981,negative,0.9579154253005981,0,2025-09-16 02:31:59+00,2025-09-18 15:45:21.607925+00
271590,GTA V,"Easily the best GTA (because it has lots to do online as well)

San Andreas is clearly the best, but this game is a very close 2nd

Rockstar never disappoints",0.9174884557723999,positive,0.9174884557723999,0,2025-09-15 23:42:54+00,2025-09-18 15:45:21.727174+00
440,Team Fortress 2,"its a good game and its one of the oldest game i,v played",0.9767951965332031,positive,0.9767951965332031,0,2025-09-08 17:28:56+00,2025-09-18 15:45:21.810955+00
1172620,Sea of Thieves,"over all fun experience, its not full of pop up paywalls like most online games now, just nice simple fun, it can be as simple or as complex as you like as there are no real set play styles. the world is literally your oyster",0.8785703182220459,positive,0.8785703182220459,0,2025-09-02 18:22:22+00,2025-09-18 15:45:21.920552+00
1172620,Sea of Thieves,"1. found a boat
2. stole tresure
3. took it back
4. sold it
5. got home
6. opened my PC
7. bought SOT
8. got almost 20 hour in a day.
9.write this review",0,neutral,0.7949584126472473,0,2025-09-02 13:04:27+00,2025-09-18 15:45:22.045811+00
440,Team Fortress 2,What makes this game peak is that Casual is filled to the brim with racist neo-Nazis,-0.8963832259178162,negative,0.8963832259178162,0,2025-08-31 20:25:37+00,2025-09-18 15:45:22.121025+00
271590,GTA V,"GTA V: Legacy keeps the classic experience alive. All the iconic missions, open-world chaos, and memorable characters remain just as fun as ever. Perfect for nostalgia or first-time players who want the original feel.

It’s a reminder of why GTA V became a modern classic—chaotic, hilarious, and endlessly entertaining.",0.9528365135192871,positive,0.9528365135192871,0,2025-09-15 20:02:23+00,2025-09-18 15:45:22.238071+00
1172620,Sea of Thieves,"This game is amazeing.
 the graphics are nice.
 the gameplay to is very good.
 i love the quests/voyage there are both short and long ones!

Play with at least 1 friend it's a bit more of a challenge alone.
But if you're down for a challenge go for it!

All in all it's an amazeing game i would 100% recommend this to my cat.",0.9712952375411987,positive,0.9712952375411987,0,2025-09-02 12:18:13+00,2025-09-18 15:45:22.371757+00
440,Team Fortress 2,"This game consumed too much about my life.





Reccomended",-0.8501200675964355,negative,0.8501200675964355,0,2025-08-31 14:52:57+00,2025-09-18 15:45:52.528464+00
440,Team Fortress 2,funny game make me happy you no go crazy unless you play 24/7,0.9315586090087891,positive,0.9315586090087891,0,2025-08-30 01:11:32+00,2025-09-18 15:45:52.623296+00
