app_id,game_name,review_text,sentiment_score,sentiment_label,sentiment_confidence,review_helpful,review_timestamp,processed_timestamp
1172620,Sea of Thieves,Fun game with a steep learning curve. Better with friends.,0.9571182131767273,positive,0.9571182131767273,0,2025-09-02 08:33:57+00,2025-09-18 15:45:52.719122+00
1172620,Sea of Thieves,"Very fun for people who enjoy large world and open exploration in their game. Lots of vendors and outposts to go to and a lot of treasure to uncover. Love the progression, especially being able to buy your own ship when you have the gold. Its a of fun with more people and larger ships require larger groups. Overall a ton of fun, for a game that I was told about to by one of my friends.",0.9784508943557739,positive,0.9784508943557739,0,2025-09-02 03:59:53+00,2025-09-18 15:45:52.871735+00
1172620,Sea of Thieves,"Its fun with friends and solo, I like this style of gtaphics, the game always has something fresh to do with a new seasons every month with fresh voyages that range from long time to a few hours as well as just roaming around completing forts, and customizing your ship.",0.9650931358337402,positive,0.9650931358337402,0,2025-09-01 19:16:35+00,2025-09-18 15:45:53.004197+00
1172620,Sea of Thieves,good but buggy and pretty frequently lagging,-0.8855696320533752,negative,0.8855696320533752,0,2025-09-01 17:46:08+00,2025-09-18 15:45:53.110229+00
440,Team Fortress 2,"really fun, and timeless game.",0.981940746307373,positive,0.981940746307373,0,2025-08-25 07:01:50+00,2025-09-18 15:45:53.183979+00
271590,GTA V,it always crashes and there is no fixes and i loved this game and enhanced edition is just as bad :(,-0.9502740502357483,negative,0.9502740502357483,0,2025-09-15 15:51:05+00,2025-09-18 15:45:53.283059+00
1172620,Sea of Thieves,Great fun game for solo play and with a friend group 9/10  would recommend again,0.9889780879020691,positive,0.9889780879020691,0,2025-09-01 16:55:01+00,2025-09-18 15:45:53.383211+00
1172620,Sea of Thieves,"fix servers on EU, Ukraine. idiot's everytime ping 100+ and micro lag...",-0.919642984867096,negative,0.919642984867096,0,2025-09-01 13:46:54+00,2025-09-18 15:45:53.478493+00
271590,GTA V,"GTA V is such a nostalgic experience that really brings back the classic thrill of heist gameplay. The game delivers exciting action, fun mechanics, and endless ways to enjoy the open world. The story and adventures are engaging, while the freedom to explore makes it even better. It’s a timeless game that I always enjoy coming back to.",0.9831669926643372,positive,0.9831669926643372,0,2025-09-15 07:06:23+00,2025-09-18 15:46:23.652244+00
271590,GTA V,crashes ALLL THE TIMMEEE during the little cut scenes in story mode. can't get past certain missions so i uninstalled. Fun when it works though,-0.662362277507782,negative,0.662362277507782,0,2025-09-15 04:21:03+00,2025-09-18 15:46:23.752036+00
271590,GTA V,Cut be beter to ecspensive categorie but sure iets oke,0,neutral,0.672595739364624,0,2025-09-14 19:50:15+00,2025-09-18 15:46:23.840915+00
440,Team Fortress 2,"Game should've stayed back in the 90s, when it was conceived.",-0.6051062941551208,negative,0.6051062941551208,0,2025-08-26 19:22:38+00,2025-09-18 15:46:23.931495+00
1172620,Sea of Thieves,gerçekten eğlenceli oyun  hikaye bakımından  geniş ve akıcı bir oyun. istediğin şekilde takılabiliyorsun istersen denizlerde üstünlük kurarak savaş istersen sakin takılarak görevler yap bu sizin seçiminiz. oyunu alınca pişman olmazsınız. fakat fiyat bakımından bütçesi düşük olanlar için  fiyat üstün kalıyor. bunun  yüzünden indirimleri takip edebilirsiniz.,0,neutral,0.856802225112915,0,2025-09-01 09:42:42+00,2025-09-18 15:46:24.187778+00
1172620,Sea of Thieves,"This game has a lot for you to explore, find out the rest yourself, i love this game. but i got the game on sale so i got lucky, probably not a lot have that chance to get it like that :/",0.955532431602478,positive,0.955532431602478,0,2025-09-01 07:27:01+00,2025-09-18 15:46:24.308631+00
440,Team Fortress 2,on life support but still fun,0.5410943031311035,positive,0.5410943031311035,0,2025-08-25 00:02:14+00,2025-09-18 15:46:24.397143+00
271590,GTA V,Have 400+ hours on this game and it won't let me play because it wants the activation code I already used.,-0.906532347202301,negative,0.906532347202301,0,2025-09-14 17:41:54+00,2025-09-18 15:46:24.493458+00
271590,GTA V,Game is fun graphics still hold up to today.,0.9758744239807129,positive,0.9758744239807129,0,2025-09-14 13:56:44+00,2025-09-18 15:46:24.569642+00
271590,GTA V,One of the best games of its era. Timeless fun and always easy to come back to. Truly never gets old. Well done Rockstar.,0.9829075932502747,positive,0.9829075932502747,0,2025-09-14 09:43:35+00,2025-09-18 15:46:24.663922+00
1172620,Sea of Thieves,this game wont let me in and wont refund because i spent of 10 hours trying to get in and i havent even played it,-0.9308726191520691,negative,0.9308726191520691,0,2025-09-01 00:15:15+00,2025-09-18 15:46:54.817116+00
440,Team Fortress 2,yes so good yes it becomes less toxic as you play on!,0.9688810706138611,positive,0.9688810706138611,0,2025-08-19 00:21:40+00,2025-09-18 15:46:54.89258+00
271590,GTA V,so i bought the game for like 60$ and they now release a GTA+ so i pay for it monthly for a game full of bugs and cheaters...  NEVER!,-0.923398494720459,negative,0.923398494720459,0,2025-09-14 09:23:13+00,2025-09-18 15:46:54.985881+00
271590,GTA V,This game is fun when you are in a public lobby without modder but sadly every public lobby has modders. Most of these modders don't give a shit and will purposely grief you. Grieving was already bad on public but having someone modding and grieving makes it way worst. As someone who plays legit unlike these unskilled modder who needs mod to make things fun for themselves I wouldn't recommend getting this game unless you play in private lobby or if you are willing to just get griefed. The amount of times I got messed with by a modder is insane and the fact this game can't handle these modder is even more annoying. My friends told me to get the enhanced gta too but guess what that game is going to slowly get modders as well. Honestly game might be fun for a bit but not for the long run. Not worth your money.,-0.8868355751037598,negative,0.8868355751037598,0,2025-09-14 05:52:05+00,2025-09-18 15:46:55.189122+00
440,Team Fortress 2,Never played so fun and so broken game 10/10,-0.6775698661804199,negative,0.6775698661804199,0,2025-09-16 14:40:05+00,2025-09-18 15:46:55.266877+00
1172620,Sea of Thieves,"Solo sloopin' it for fun. Get to emissary 5 with order of souls. Get chased by three skeleton ships. Almost sink twice. End up sinking all skelly ships. Loot skelly ships. BIG rep/gold. Get excited. Sail away to sell booty. Run over stray gunpowder keg. Lose everything. Waste of 3 hours. 10/10 experience, I love this game.",0.5489708185195923,positive,0.5489708185195923,0,2025-08-31 22:50:21+00,2025-09-18 15:46:55.409266+00
1172620,Sea of Thieves,"its p fun, it js sucks when your a noob and you get raided by 15 other pros and die, loose all of your treasure",-0.725939154624939,negative,0.725939154624939,0,2025-08-31 17:56:42+00,2025-09-18 15:46:55.506969+00
1172620,Sea of Thieves,"It's fun, but when other crews are better than you, they are so much better than you. It never feels like a good fight, its always either you decimate them or they decimate you. Also the 1 shot barrels that can kill your whole ship is lame.",-0.8190427422523499,negative,0.8190427422523499,0,2025-08-31 17:26:41+00,2025-09-18 15:46:55.625243+00
271590,GTA V,come on with gta6 already man. fiveM is boring and a bunch of bs. i cant switch my xbox account to PC because i made it 20 years ago... letssss gooooo rockstar!,-0.8790534734725952,negative,0.8790534734725952,0,2025-09-14 01:47:22+00,2025-09-18 15:46:55.729099+00
440,Team Fortress 2,"Team Fortress 2 is a masterpiece that Valve has largely abandoned, yet it refuses to die. Despite experiencing no significant updates, facing a bot crisis, and suffering from balancing issues, you can still hop in and find a surprisingly nice community. Most players are just there to have fun, which is a refreshing contrast to the profound immaturity often displayed in the game. Picture this: 30-year-olds playing alongside 12-year-olds, all sharing an edgy sense of humor that can make the experience feel like a true melting pot of chaos!

When you load into a new match, whether casual or community, you meet at least 20 new players. While some are genuinely nice, many are more interested in making connections than actually playing the game. You might even receive a marriage proposal in the chat, often from someone with a name as insufferable as the proposal itself.

The game features nine unique and iconic classes, each offering something for everyone. It’s like a buffet of mayhem! The art style is reminiscent of a comic book, standing the test of time and never looking bad. The Meet the Team videos provide insight into each class's specialties and showcase the game’s goofy tone, while the SFM videos represent a beautiful art form that I hope never disappears. 

I've been playing since 2008 on PS3, and words cannot fathom my love for this game. It has a deep place in my heart, and the late nights I played with friends growing up, hold fond memories. It’s a laid-back game where you can chat and play in the background, sometimes a guilty pleasure, other times a time killer, but always somehow a good time. Despite its flaws, Team Fortress 2 remains a favorite, likely always will be, and may it live forever, continuing to evoke a sense of nostalgia and connection.",0.6954106688499451,positive,0.6954106688499451,0,2025-09-06 07:46:18+00,2025-09-18 15:46:56.24507+00
1172620,Sea of Thieves,"i like getting my ass beaten by sweaty reapers. but its all good, game is fun with people",0.6280757784843445,positive,0.6280757784843445,0,2025-08-31 13:45:17+00,2025-09-18 15:47:26.379744+00
440,Team Fortress 2,"it came out in 2009 and is still relevant, need I say more?",0,neutral,0.6758641600608826,0,2025-09-04 18:35:20+00,2025-09-18 15:47:26.477257+00
271590,GTA V,"I get that companies are designed to make money, but wow...these fools are so dang greedy. 
This is the last R* game i'll ever buy. Single-player is good - if you like GTA type games. 
GTAO is just a cash grab.",-0.8860405087471008,negative,0.8860405087471008,0,2025-09-14 00:56:20+00,2025-09-18 15:47:26.605907+00
440,Team Fortress 2,Love this game! Been a TF2 fan since I was 10. 😍😍Valve keep this game running.,0.9882764220237732,positive,0.9882764220237732,0,2025-08-19 01:03:42+00,2025-09-18 15:47:26.717968+00
271590,GTA V,"Good game, but if you want to play with friends you should know that this game is full of crazy bugs. While playing this game we expirienced bug that kick you from your friend´s lobby...it doesn´t matter if you just doing shits or playing long heists. It will just kick you from the lobby and you have to complete the mission by yourself or you gotta leave the heist and hope that it will not kick you next time. I just don´t understand why are those crazy bugs not fixed yet. 

I recommend playing this game mostly solo and if you want to play with your friends count on those bugs...",-0.7666344046592712,negative,0.7666344046592712,0,2025-09-13 20:30:28+00,2025-09-18 15:47:26.942647+00
440,Team Fortress 2,This game fills me with tremendous amounts of mirth.,0.8837662935256958,positive,0.8837662935256958,0,2025-08-29 17:46:57+00,2025-09-18 15:47:27.039907+00
440,Team Fortress 2,first in class and still being played today.,0,neutral,0.8257538676261902,0,2025-09-16 23:32:45+00,2025-09-18 15:47:27.12972+00
440,Team Fortress 2,its a commitment you cant take back once you trade you cant stop,-0.5917903780937195,negative,0.5917903780937195,0,2025-09-12 01:10:39+00,2025-09-18 15:47:27.227155+00
440,Team Fortress 2,pretty good can't wait for the engineer update tho,0.9861654043197632,positive,0.9861654043197632,0,2025-09-05 02:03:15+00,2025-09-18 15:47:27.331478+00
271590,GTA V,"The game is awesome but if your in an online server you may encounter modders because i have so if you play online join a friend or a private server
",0.8678383827209473,positive,0.8678383827209473,0,2025-09-13 18:41:33+00,2025-09-18 15:47:27.433749+00
440,Team Fortress 2,great game not recommended for normies,0.467328280210495,positive,0.467328280210495,0,2025-09-01 08:32:45+00,2025-09-18 15:47:57.551737+00
271590,GTA V,"Cannot play GTA ONLINE in public sessions anymore. It's disheartening to see such an amazing game not being properly maintained, and it allows modders to wreak havoc.",-0.940919816493988,negative,0.940919816493988,0,2025-09-13 13:04:45+00,2025-09-18 15:47:57.630217+00
440,Team Fortress 2,"very fun, that all i have to say JUST PLAY TF2 NOWW!!!",0.985944926738739,positive,0.985944926738739,0,2025-09-07 09:18:25+00,2025-09-18 15:47:57.696115+00
271590,GTA V,bro dont get this shitty ass game its gonna come with alot of problems and soultions that WILL NOT! work just dont get it for pc better off playing it on console it just sit there and load forever it was doing good when i first got it i deleted got it back now it just sits there loading forever,-0.9546549916267395,negative,0.9546549916267395,0,2025-09-13 03:45:39+00,2025-09-18 15:47:57.79443+00
440,Team Fortress 2,Best gay representation I've ever seen in a video game.,0.9789780974388123,positive,0.9789780974388123,0,2025-08-27 14:50:27+00,2025-09-18 15:47:57.87012+00
440,Team Fortress 2,probally the worse game ever made,-0.911771297454834,negative,0.911771297454834,0,2025-08-24 00:03:00+00,2025-09-18 15:47:57.938216+00
440,Team Fortress 2,Certified hood classic.,0.7383725643157959,positive,0.7383725643157959,0,2025-09-14 16:43:59+00,2025-09-18 15:47:58.010014+00
440,Team Fortress 2,"the balancing in this game is fucking terrible
",-0.9446303844451904,negative,0.9446303844451904,0,2025-09-02 21:57:10+00,2025-09-18 15:47:58.088631+00
440,Team Fortress 2,It's TF2. This game will always be fun.,0.9813530445098877,positive,0.9813530445098877,0,2025-09-08 05:53:35+00,2025-09-18 15:47:58.171999+00
440,Team Fortress 2,good game please add jake the dog from fortnite.,0.9589210748672485,positive,0.9589210748672485,0,2025-09-01 23:37:25+00,2025-09-18 15:47:58.25976+00
440,Team Fortress 2,"This game is good, great even, PLAY PYRO!!!!!",0.9891937375068665,positive,0.9891937375068665,0,2025-08-31 06:21:17+00,2025-09-18 15:48:28.368917+00
271590,GTA V,"This game is unplayable in its current state. Every day I get on and find out that the same Hackers/modders whatever, are terrorizing lobbies. Literally the same account everyday for the past week of my playing I woke up early in the morning and there was one. Then I got on after work and there was another. JewelPrincess seems to be the one that's in most NA east servers or however that works. I've reported and tried to kick to no avail. Most of the time I spend playing this game is watching the intro graphics, on a black screen loading into an ""interior"" or the inside of a building, or in the clouds. I assume all of these stem from the terrorists but I have no way of knowing because I cant even see them. This is all after a year or so hiatus just playing other games. Although the modders were there to greet me, they were bad before but I think they're worse now, I forgot to mention that there are people that periodically join lobbies and advertise selling money and account leveling which should interest rockstar considering I see the ads for shark cards every time I try to play. They could easily just ban most of the accounts if they got on the game for a few hours here and there. Not hard to miss. I was hyped for gta 6 but I won't be buying it, if Rockstar can't even run GTA 5. Ridiculous, and shameful.",-0.8814731240272522,negative,0.8814731240272522,0,2025-09-13 02:15:48+00,2025-09-18 15:48:28.732573+00
440,Team Fortress 2,"I'll be back.

For a Heavy update.

For now, it's perfect.",0.7956171035766602,positive,0.7956171035766602,0,2025-09-10 16:26:01+00,2025-09-18 15:48:28.808897+00
440,Team Fortress 2,crippling addiction for peak gaming,0,neutral,0.5084764361381531,0,2025-09-05 12:31:40+00,2025-09-18 15:48:28.866992+00
440,Team Fortress 2,Another great Valve game.,0.9837667942047119,positive,0.9837667942047119,0,2025-08-27 16:52:31+00,2025-09-18 15:48:28.928994+00
440,Team Fortress 2,Pretty good game. I've played it a bit.,0.9803549647331238,positive,0.9803549647331238,0,2025-08-24 02:50:39+00,2025-09-18 15:48:28.997858+00
271590,GTA V,"rockstar has started banning people for using profanity in text or voice chat, this game is rated M and intended for audiences above 17 years, if you cant handle the occasional fuck or shit you shouldn't be playing this game. rockstar shame on you. you use the vocabulary in your game but ban people for using it themselves.",-0.9292473196983337,negative,0.9292473196983337,0,2025-09-12 22:03:26+00,2025-09-18 15:48:29.115157+00
271590,GTA V,"Positive
Worlds feel alive. Captures the atmosphere of an over the top Los Angeles. Honestly just needs more crazy homeless people.
Classic Rockstar. The writing, especially the character writing, is great.
Music is great and helps build the world feeling, excellent.

Negative
Shooting while PvP'ing doesn't feel that great. 
Multiplayer monetization is a bit predatory. 
Some missions makes me go, ""who thought of this?"". For instance the tow truck mission.",0.6492232084274292,positive,0.6492232084274292,0,2025-09-12 19:02:37+00,2025-09-18 15:48:29.278306+00
440,Team Fortress 2,wishes it was call of duty since the inception. =D,0.7206469774246216,positive,0.7206469774246216,0,2025-09-15 12:48:18+00,2025-09-18 15:48:29.370025+00
440,Team Fortress 2,Help I fucked up and got more than 420 hours kill me Medic I am The Spy fridge,-0.8952842950820923,negative,0.8952842950820923,0,2025-08-27 21:35:06+00,2025-09-18 15:48:29.457485+00
440,Team Fortress 2,If I were a bad demoman I would be sitting here discussing it with ya would I?,-0.6701390743255615,negative,0.6701390743255615,0,2025-09-05 01:43:40+00,2025-09-18 15:48:59.616101+00
440,Team Fortress 2,this game is a masterpiece that is old.,0.9248403310775757,positive,0.9248403310775757,0,2025-08-24 22:29:28+00,2025-09-18 15:48:59.68907+00
440,Team Fortress 2,"It's TF2

You know what it is and you know it's good",0.9216156005859375,positive,0.9216156005859375,0,2025-08-24 01:30:22+00,2025-09-18 15:48:59.767885+00
440,Team Fortress 2,people on here still say shit like pog and noice,-0.8415249586105347,negative,0.8415249586105347,0,2025-08-24 18:27:12+00,2025-09-18 15:48:59.839983+00
271590,GTA V,"Great, fun game that has been milked for all that it is worth. Didn't find the story mode interesting, but the online was peak for a year or so.",0.9465310573577881,positive,0.9465310573577881,0,2025-09-12 16:12:36+00,2025-09-18 15:48:59.924825+00
440,Team Fortress 2,mega sima (Sugma) game amaing toy gqames,0,neutral,0.799201488494873,0,2025-08-26 06:13:09+00,2025-09-18 15:48:59.989453+00
440,Team Fortress 2,There used to be a good game 10 years ago,0.6493880152702332,positive,0.6493880152702332,0,2025-08-24 00:50:36+00,2025-09-18 15:49:00.060181+00
271590,GTA V,"The game has only been out 10+ years, give them time to fix the bugs.",-0.7591269612312317,negative,0.7591269612312317,0,2025-09-12 04:50:46+00,2025-09-18 15:49:00.136505+00
440,Team Fortress 2,I love it when people argue in this game,0.7975444793701172,positive,0.7975444793701172,0,2025-09-06 14:51:22+00,2025-09-18 15:49:00.209925+00
271590,GTA V,"A Timeless Classic Rating: ★★★★★ (5/5)
GTA 5 is one of the best open-world games I've ever played. From the moment you start, you're pulled into an incredibly detailed and immersive world that feels alive. The storyline is exciting and packed with action, humor, and unforgettable characters like Trevor, Michael, and Franklin.

The freedom the game gives you is amazing—you can follow missions, explore the city, drive around, fly planes, go diving, or just cause chaos for fun. The graphics still hold up really well, even years after release. Plus, the soundtrack is top-notch and fits the vibe of the game perfectly.

GTA Online adds even more value, letting you play with friends, do heists, build businesses, and more. Rockstar really put a lot of love into this game, and it shows.

Overall, GTA 5 is not just a game, it’s an experience. Whether you’re playing for the story or just roaming around Los Santos, there’s always something to do.",0.9622094035148621,positive,0.9622094035148621,0,2025-09-12 02:11:41+00,2025-09-18 15:49:00.474809+00
440,Team Fortress 2,come on man its tf2 its the best game ever,0.9702916741371155,positive,0.9702916741371155,0,2025-08-29 22:18:41+00,2025-09-18 15:49:30.611936+00
271590,GTA V,This game is basically unplayable I've played it a lot then took a break and I have tried playing it again but there are so many modders and so many bugs that wont let you enter buildings without crashing your game otherwise its fun but come on rockstar smooth out your game,-0.919967532157898,negative,0.919967532157898,0,2025-09-11 20:23:33+00,2025-09-18 15:49:30.719468+00
440,Team Fortress 2,Haven't played much but it's pretty good,0.8475877046585083,positive,0.8475877046585083,0,2025-08-27 20:31:47+00,2025-09-18 15:49:30.788733+00
271590,GTA V,"3 hours tryd casino heist, all the time somebody leaves or dies same place over and over. Not a first day qiuting game after 2-4 hours frustrating trys to complete heist with randoms because if someone leaves all heist cancels and u have to drive and start it all over, so basicly when game half of trolls is taking too much time to complete simple heist with randoms.",-0.8214433193206787,negative,0.8214433193206787,0,2025-09-11 13:28:54+00,2025-09-18 15:49:30.938881+00
440,Team Fortress 2,If you like this game you are the problem.,-0.8751598000526428,negative,0.8751598000526428,0,2025-09-12 18:59:19+00,2025-09-18 15:49:31.073081+00
440,Team Fortress 2,funny shot shot gane,0.5076696276664734,positive,0.5076696276664734,0,2025-08-29 22:04:46+00,2025-09-18 15:49:31.186297+00
271590,GTA V,game so good i actually bought it(i originally pirated it) now while steam may say i only spewnt some 53 hours on the game i have spent more than triple that playing the game pirated and it was so good i BOUGHT(and also because i wanted to play online) SO ABOSLUTELY WORTH YOUR TIME IF IT MADE SOMEBODY ACTUALLY BUY THE GAME AFTER PIRATING IT,0.9663395285606384,positive,0.9663395285606384,0,2025-09-11 12:49:00+00,2025-09-18 15:49:31.39773+00
440,Team Fortress 2,Literally the best game ever 😭,0.9835180044174194,positive,0.9835180044174194,0,2025-08-20 19:47:02+00,2025-09-18 15:49:31.470673+00
271590,GTA V,Very good game big map and arsenal of guns,0.9803184866905212,positive,0.9803184866905212,0,2025-09-11 05:09:08+00,2025-09-18 15:49:31.550243+00
271590,GTA V,"After many years, they required Battle Eye installation. I will not install spyware to play a game I only play in story mode, and there is no option for playing the game at res without installing that shit. You don't own games you only rent them, thanks Steam and Rockstar! Great Job!",-0.8333781957626343,negative,0.8333781957626343,0,2025-09-11 04:58:33+00,2025-09-18 15:49:31.683712+00
440,Team Fortress 2,i mean its team fortress what'd you expect,0,neutral,0.6860067248344421,0,2025-08-20 00:58:37+00,2025-09-18 15:50:01.819691+00
271590,GTA V,"ChatGPT said: Grand Theft Auto V jest gra akcji-przygodowa z 2013, robiona przez Rockstar North i wydana przez Rockstar Games. To jest siódma główna część w serii Grand Theft Auto, po 2008 Grand Theft Auto IV, i piętnasta część razem. Akcja jest w wymyślonym stanie San Andreas, co jest na bazie południowa Kalifornia. Historia dla jednego gracza idzie za trzech bohaterów MAJKELEJ SANTOS, uliczny gangster CZARNY), i handlarz narkotyków i broni Trevor FILIP (Steven Ogg) — i ich próby robić napady kiedy mają presję od skorumpowana agencja rządowa i silni kryminaliści. Gracze mogą wolno chodzić po otwarty świat San Andreas, wieś i wymyślone miasto Los Santos, co jest na bazie Los Angeles.",0,neutral,0.8225204348564148,0,2025-09-10 19:44:14+00,2025-09-18 15:50:02.163194+00
440,Team Fortress 2,"Addicting game, heavy ftw",0,neutral,0.6133571863174438,0,2025-09-17 20:10:07+00,2025-09-18 15:50:02.244237+00
271590,GTA V,"very good and realistic game, and for the good price its worth it, i reccomend",0.9865871071815491,positive,0.9865871071815491,0,2025-09-10 19:09:49+00,2025-09-18 15:50:02.317951+00
440,Team Fortress 2,Still alive and kicking,0.8200507164001465,positive,0.8200507164001465,0,2025-09-11 23:36:50+00,2025-09-18 15:50:02.380351+00
440,Team Fortress 2,Very fun. No bots,0.9583288431167603,positive,0.9583288431167603,0,2025-09-08 14:35:06+00,2025-09-18 15:50:02.445225+00
440,Team Fortress 2,Sasha is protected in the hands of Heavy,0,neutral,0.631781816482544,0,2025-09-01 19:07:03+00,2025-09-18 15:50:02.531627+00
271590,GTA V,online is fun if you have a lot of stuff and its really fun got about 27 million jus sitting in the bank dawg,0.9703772068023682,positive,0.9703772068023682,0,2025-09-10 18:15:08+00,2025-09-18 15:50:02.637183+00
271590,GTA V,GTAV is the best game ever never gets old and never get tired of playing it still gonna be better then GTAVI,0.9767786264419556,positive,0.9767786264419556,0,2025-09-10 06:10:50+00,2025-09-18 15:50:02.734671+00
440,Team Fortress 2,anything for my queen ms pauling,0.896125853061676,positive,0.896125853061676,0,2025-08-29 06:01:42+00,2025-09-18 15:50:02.816563+00
